Image;Source;URL;Text;Complexity;Real/Fake;Sentiment1;Sentiment2;Political
exemplu.jpg;cespun.eu;https://cespun.eu/wp-content/uploads/2017/01/_d_improd_/imagini-amuzante-scris4_f_improf_926x810.jpg;SPUNE, UNDE ESTE PARTENERUL TĂU ?;Simple;Real;Neutral;Manie;No
america.webp;reddit.com;https://www.reddit.com/r/romemes/comments/1d6zcge/ce_bine_că_e_doar_în_america_așa/#lightbox;Noi angajați de la McDonald's când văd otravă de șoareci și plicuri de laxaive puse în sertarul ”Pentru clienți”;Simple;Real;Negative;Frica;No
1tfs8vwck64d1.jpeg;reddit.com;https://www.reddit.com/r/romemes/comments/1d6gd4f/relaxarea_suprema_duminica/#lightbox;Românii cand aud in copaci pasari diverse țipând si ciripind flindca sunt excitate in calduri si vor sex;Simple;Real;Neutral;Tristete;No
7d2wemn9g44d1.png;reddit.com;https://www.reddit.com/r/romemes/comments/1d68xrk/howdy/#lightbox;Cum se uită gândacii la tine când aprinzi lumina în bucătărie.;Simple;Real;Neutral;Surpriza;Yes
ozkp8mj5uw3d1.png;reddit.com;https://www.reddit.com/r/romemes/comments/1d5hc15/never_mess_with_bunica/#lightbox;Bunica pregătită să-mi dea perversa după ce i-am zis că nu imi e foame;Simple;Real;Negative;Frica;No
x62i44yuce4d1.png;reddit.com;https://www.reddit.com/r/romemes/comments/1d7b46f/jos_cu_satanistii_care_ne_conduc/#lightbox;PARTIDUL SATANIST DOMINANT;Simple;Fake;Negative;Manie;Yes
1ooYwyF.jpg;reddit.com;https://www.reddit.com/r/romemes/comments/xloycf/spune_corect/#lightbox;pulverizator  fâs-fâs;Combination;Real;Positive;Bucurie;No
vp0cpx6dz4381.png;reddit.com;https://www.reddit.com/r/romemes/comments/xy859k/va_amintiti_winamp_si_prince_of_persia/#lightbox;Zi de nastere in anii 2000:;Combination;Real;Positive;Bucurie;No
4w99mdrqcom91.png;reddit.com;https://www.reddit.com/r/romemes/comments/x97gzb/london_bridge_down/#lightbox;MĂI ELISABETA, MĂI ȘI CE TÂNĂRĂ ERAI;Simple;Real;Negative;Tristete;No
e911mny3rfw61.jpg;reddit.com;https://www.reddit.com/r/romemes/comments/n2b248/germany_we_lose_the_war_romania_you_lose_the_war/#lightbox;Germania: Pierdem războiul!! România: TU îl pierzi;Simple;Fake;Positive;Surpriza;Yes
m3d73ypsbrd51.jpg;reddit.com;https://www.reddit.com/r/romemes/comments/hzx1dg/litoral_2021/#lightbox;ÎN SFARSIT STAȚIUNEA TATAIA;Combination;Real;Neutral;Surpriza;No
ivae4pf6770d1.jpeg;reddit.com;https://www.reddit.com/r/romemes/comments/1cqzot9/spaima_vanzatoarei_de_la_chioșc/#lightbox;O eugenie;Simple;Fake;Neutral;Bucurie;No
80w5x8f37yq91.jpg;reddit.com;https://www.reddit.com/r/romemes/comments/xrv2x1/sorin_campeanu/#lightbox;> devine ministrul educatiei > FUTE TOT SISTEMUL > nu elaboreaza > isi da demisia;Simple;Fake;Negative;Manie;Yes
dcc0b9sipdub1.jpg;reddit.com;https://www.reddit.com/r/romemes/comments/178gwil/as_vrea_sa_va_spun_ca_glumesc_daar/#lightbox;Când auzi că se închide FileList;Simple;Real;Negative;Tristete;No
x6t4hy1vom491.jpg;reddit.com;https://www.reddit.com/r/romemes/comments/v8loa8/preluată_de_pe_fb/#lightbox;Bucuresteni: "E mai mare chiria că plätesti zona" Zona:;Simple;Real;Negative;Tristete;No
0n14f4fb4zaa1.jpg;reddit.com;https://www.reddit.com/r/romemes/comments/1078hyx/cine_dracu_cumpără_200_de_mere/#lightbox;Eu si cu tata chinuindu-ne cu tema la mate din clasa a doua;Combination;Real;Negative;Tristete;No
hqcg0f27id1b1.jpg;reddit.com;https://www.reddit.com/r/romemes/comments/13ojb8u/oh_nu/#lightbox;Profesorii: *fac grevă, iar orele nu se tin* Elevii care nu sunt an terminal:;Combination;Real;Negative;Manie;Yes
49ecwfsxu4ub1.jpg;reddit.com;https://www.reddit.com/r/romemes/comments/177l960/ce_nume_ar_avea/#lightbox;De ce juratii de la Masterchef România din 2012, arată ca o trupă pop/rock?;Simple;Real;Neutral;Surpriza;No
2c8ame63mlca1.png;reddit.com;https://www.reddit.com/r/romemes/comments/10eb91h/in_tine_sunt_2_lupi/#lightbox;Ai 16 ani din ce metrix trebuie să scapi bă vere uită te dreq la Ben 10 si lasă l pe Andrew Tate;Simple;Real;Negative;Manie;No
dcsfqdje3sob1.jpg;reddit.com;https://www.reddit.com/r/romemes/comments/16kvgrf/serios_alex_nu_mă_așteptam/#lightbox;Sunt pasionat de fotbal și de mașini;Simple;Fake;Neutral;Tristete;No
xgp4vt0mmbxb1.jpg;reddit.com;https://www.reddit.com/r/romemes/comments/17jqqes/o_mânã_de_oameni_pro_ruși_vor_sã_interzicã/#lightbox;Romanii: noi nu serbam Halloween, e un obicei anti-crestin sa iti pui masti de demoni Tot romanii:;Simple;Real;Neutral;Surpriza;No
y9totu55qzxa1.jpg;reddit.com;https://www.reddit.com/r/romemes/comments/138bvdl/tipic/#lightbox;Cluj 120k ron;Simple;Fake;Negative;Tristete;No
0w2ztzexxzr91.jpg;reddit.com;https://www.reddit.com/r/romemes/comments/xwbye1/das_auto/#lightbox;"hai coae ca nu patesti nimic...";Simple;Fake;Negative;Frica;No
ydb7bab3nuvc1.jpeg;reddit.com;https://www.reddit.com/r/romemes/comments/1c9kb3e/numa_necazuri/#lightbox;Când nu știi ce să alegi...;Combination;Fake;Negative;Tristete;Yes
81abhsroaxw81.jpg;reddit.com;https://www.reddit.com/r/romemes/comments/ug8fqa/help_nu_stiu_ce_sa_mai_fac/#lightbox;NU AM VIATA SOCIALA DUPA CE AM STAT TOATA VIATA IN FATA PC-ULUI;Combination;Fake;Negative;Tristete;No
o9jw5f7nqu091.jpg;reddit.com;https://www.reddit.com/r/romemes/comments/uuq2em/faraonu_lactate/#lightbox;DESCOPERIRE ARHEOLOGICĂ! FARAON ÎN VASLUI;Simple;Real;Neutral;Surpriza;No
Albert Einstein.jpg;pinterest.com;https://www.pinterest.com/pin/65865213287170366/;Vrei să-ți trag o cârja?;Simple;Real;Negative;Manie;No
.jpg;pinterest.com;https://www.pinterest.com/pin/127226758214946392/;sa mori tu;Simple;Fake;Neutral;Manie;No
b6a149420210dd5bacddaa5190415f34.jpg;pinterest.com;https://ro.pinterest.com/pin/4714774599801055/;P-ăsta nu-l prinde politia niciodată. Aude sirena cu 3 zile înainte.;Simple;Fake;Neutral;Surpriza;No
Dormeo.jpg;pinterest.com;https://ro.pinterest.com/pin/11822017759683119/;DORMEO... ..NOAPTE BUNĂ;Combination;Fake;Negative;Frica;No
 -2.jpg;pinterest.com;https://ro.pinterest.com/pin/68046644363047973/;Sună mã si te rezolv...;Simple;Real;Positive;Bucurie;No
 -3.jpg;pinterest.com;https://ro.pinterest.com/pin/212443307417140467/;Când afli in pauză că ai avut temă;Combination;Real;Neutral;Frica;No
 -4.jpg;pinterest.com;https://ro.pinterest.com/pin/46443439895653643/;CATALIN, Al LEGATURA! Da Andrea am legătura;Combination;Real;Neutral;Surpriza;No
 -5.jpg;pinterest.com;https://ro.pinterest.com/pin/190840102950400270/;Bea o gură si taci!;Simple;Real;Positive;Bucurie;No
 -6.jpg;pinterest.com;https://ro.pinterest.com/pin/127226758214946397/;Hey, scuze, cred ca m-ai lăsat cu seen din greseala;Simple;Real;Neutral;Surpriza;No
 -7.jpg;pinterest.com;https://ro.pinterest.com/pin/277534395780533934/;in drum spre inima ta;Simple;Real;Positive;Dragoste;No
 -8.jpg;pinterest.com;https://ro.pinterest.com/pin/127226758214926304/;AI DE PLM;Simple;Fake;Negative;Tristete;No
 -9.jpg;pinterest.com;https://ro.pinterest.com/pin/65865213287272095/;Am nimerit la nebuni! Vaiii, ce-mi place!;Simple;Real;Positive;Bucurie;No
 -10.jpg;pinterest.com;https://ro.pinterest.com/pin/68046644363045030/;MAI RAR AȘA CEVA;Simple;Real;Neutral;Surpriza;No
 -11.jpg;pinterest.com;https://ro.pinterest.com/pin/10766486603661937/;Se aproba;Simple;Real;Positive;Bucurie;Yes
 -12.jpg;pinterest.com;https://ro.pinterest.com/pin/68046644363044976/;AI GRIJA CE SPUI CA NU TE MAI SPOVEDESC;Simple;Real;Negative;Frica;No
 -13.jpg;pinterest.com;https://ro.pinterest.com/pin/68046644363047979/;MA IA CU FREZOANE;Simple;Real;Neutral;Tristete;No
 -14.jpg;pinterest.com;https://ro.pinterest.com/pin/281543722713701/;Hm. Imi pute a gay;Simple;Fake;Neutral;Surpriza;No
 -15.jpg;pinterest.com;https://ro.pinterest.com/pin/70861394131671614/;HALBĂ CA ZĂPADA ȘI CEI ȘAPTE MICI;Simple;Real;Positive;Bucurie;No
Unknown.jpg;pinterest.com;https://ro.pinterest.com/pin/117938083984267828/;TACÂMURI PENTRU DIETĂ;Simple;Real;Neutral;Surpriza;No
 -16.jpg;pinterest.com;https://ro.pinterest.com/pin/212443307417140468/;Tu mi faci inima sã bată Cum nu o face nicio fată;Simple;Real;Neutral;Frica;No
 -17.jpg;pinterest.com;https://ro.pinterest.com/pin/4714774600313518/;PETRECEREA DE PIETONI;Simple;Fake;Positive;Bucurie;No
 -18.jpg;pinterest.com;https://ro.pinterest.com/pin/212443307417089816/;RO ALERT EU;Simple;Real;Negative;Frica;No
 -19.jpg;pinterest.com;https://ro.pinterest.com/pin/338262622029156530/;NOUL ALBUM AL LUI SALAM;Simple;Real;Neutral;Surpriza;No
 -20.jpg;pinterest.com;https://ro.pinterest.com/pin/590745676150706744/;Profa: Porniti camerele sa va vad Eu care de abia m-am trezit:;Simple;Real;Neutral;Surpriza;No
441196270_450960817625350_3061497453595892013_n.jpg;facebook.com;https://www.facebook.com/photo/?fbid=450960777625354&set=a.103913115663457;Client: Oare de ce vine mancarea rece ?;Simple;Real;Negative;Surpriza;No
431186658_409128691808563_4040799327580692939_n.jpg;facebook.com;https://www.facebook.com/photo/?fbid=409128608475238&set=a.140264718694963;Intotdeauna se găseste o prietenă căreia să-i fie frică la filmele de groaza;Combination;Real;Neutral;Surpriza;No
404997876_345500474838052_6282824953073103411_n.jpg;facebook.com;https://www.facebook.com/photo/?fbid=345500478171385&set=a.140264718694963;Mă pun la somn să mă odihnesc si visez că lucrez;Simple;Fake;Neutral;Frica;No
440058715_443240775064021_6300648858240467975_n.jpg;facebook.com;https://www.facebook.com/photo/?fbid=443240778397354&set=a.140264718694963;degeaba ma abin sã nu zic ceva, că mi se citeşte pe fată;Simple;Real;Negative;Manie;No
431071148_404131768974922_3208362728933434205_n.jpg;facebook.com;https://www.facebook.com/photo/?fbid=404131728974926&set=a.140264718694963;"de ce nu vrei sa intrii la o cafea?" sosetele mele:;Simple;Real;Neutral;Surpriza;No
431076585_404825542238878_3741912701135914085_n.jpg;facebook.com;https://www.facebook.com/photo/?fbid=404825485572217&set=a.140264718694963;Azi esti tanar, maine ii faci crispy la o pitica de 1,56 cu nervi turbo diesel de stie sa loveascã la ficat;Simple;Real;Neutral;Frica;No
425504676_1090497521974034_1249677144923454041_n.jpg;facebook.com;https://www.facebook.com/photo/?fbid=1090497498640703&set=gm.1757344158065090&idorvanity=990963711369809;Când te cheamă bietii la furat dar mă-ta nu te lasă să iesi din casă;Combination;Fake;Neutral;Tristete;No
417776937_1075929060097547_2219820023527904890_n.jpg;facebook.com;https://www.facebook.com/photo/?fbid=1075929033430883&set=gm.1741507052982134&idorvanity=990963711369809;Am lista cu toti care au dat cu petarde, îi astept sã treac cu bicicleta.;Simple;Real;Negative;Manie;No
410894749_1095827864926601_4337267014987267069_n.jpg;facebook.com;https://www.facebook.com/photo/?fbid=1095827878259933&set=gm.1728904794242360&idorvanity=990963711369809;VÂND OM DE ZĂPADĂ DEMONTAT;Simple;Real;Neutral;Surpriza;No
400621085_1045894336434353_313474375295542894_n.jpg;facebook.com;https://www.facebook.com/photo/?fbid=1045894319767688&set=gm.1709590222840484&idorvanity=990963711369809;Eu: Am luat salariul. Maşina: Salariul nostru;Simple;Fake;Negative;Tristete;No
354456146_1204017804331133_2051057632009723038_n.jpg;facebook.com;https://www.facebook.com/photo/?fbid=1204017807664466&set=gm.1627794114353429&idorvanity=990963711369809;Trezitul nu e o problemã Cu ridicatul din pat e mai greu..;Simple;Fake;Negative;Tristete;No
376037829_1340147593595957_3618935269938336647_n.jpg;facebook.com;https://www.facebook.com/photo/?fbid=1340147596929290&set=gm.1675443699588470&idorvanity=990963711369809;- Nu o să mai găsesti niciuna ca mine! - Aşa să m-ajute Dumnezeu;Combination;Real;Neutral;Manie;No
373299584_1039997940509594_8979389406603963583_n.jpg;facebook.com;https://www.facebook.com/photo/?fbid=1039997913842930&set=gm.1668705043595669&idorvanity=990963711369809;îti arät eu revoltă imediat...;Simple;Fake;Negative;Manie;Yes
351309351_218353977725348_6210578767431041000_n.jpg;facebook.com;https://www.facebook.com/photo/?fbid=966551971035257&set=gm.1621145241684983&idorvanity=990963711369809;Noaptea in alte tări. Noaptea in România.;Combination;Real;Negative;Frica;No
369471634_1245291863537060_8591066378106121870_n.jpg;facebook.com;https://www.facebook.com/photo/?fbid=1245291870203726&set=gm.1663550484111125&idorvanity=990963711369809;CÂND NU VREI SĂ SIMTĂ TAC-TU CĂ AI FUMAT IN MASINA LUI;Simple;Real;Neutral;Frica;No
444458268_10231473401399433_6584007209167027935_n.jpg;facebook.com;https://www.facebook.com/photo/?fbid=10231473401439434&set=gm.7880482255347294&idorvanity=2077133242348920;DE 1 IUNIE SĂ NU UITĂM DE CEL MICI!;Simple;Real;Neutral;Bucurie;No
444193428_972833437878207_4473686593179060502_n.jpg;facebook.com;https://www.facebook.com/photo/?fbid=972833444544873&set=gm.7862388910489962&idorvanity=2077133242348920;Ăstia puteam fi noi dar tie ti-a plăcut scoala;Simple;Real;Neutral;Tristete;No
438096708_10231352347053150_3594729840585343913_n.jpg;facebook.com;https://www.facebook.com/photo/?fbid=10231352347093151&set=gm.7784842628244591&idorvanity=2077133242348920;Când ești in perfectă armonie cu natura.;Simple;Real;Neutral;Surpriza;No
441279321_958736742621210_7720865533366781281_n.jpg;facebook.com;https://www.facebook.com/photo/?fbid=958736715954546&set=gm.7751252698270251&idorvanity=2077133242348920;Mergi sa-i cunosti parintii si i suna telefonu' lu' tacsu la tine in geacă;Combination;Fake;Neutral;Frica;No
434425244_7059118547551240_7916372849699441406_n.jpg;facebook.com;https://www.facebook.com/photo/?fbid=7059118567551238&set=gm.7598744056854450&idorvanity=2077133242348920;Cum plătiți? Cu lacrimi în ochi!;Simple;Real;Negative;Tristete;No
434632820_7059113410885087_1660315003916997797_n.jpg;facebook.com;https://www.facebook.com/photo/?fbid=7059113297551765&set=gm.7598738510188338&idorvanity=2077133242348920;Prieteni: Când o sã ai si tu copii? Eu: Am deja un copil;Simple;Real;Positive;Dragoste;No
434054281_7059114724218289_5585073462344990028_n.jpg;facebook.com;https://www.facebook.com/photo/?fbid=7059114757551619&set=gm.7598739976854858&idorvanity=2077133242348920;Tu si acel prieten, în parcare la Kautland, la ora 24, după două beri:;Simple;Fake;Positive;Bucurie;No
430050075_10231000555338577_6332892781437023655_n.jpg;facebook.com;https://www.facebook.com/photo/?fbid=10231000555378578&set=gm.7498199220242268&idorvanity=2077133242348920;Dacă nu vă potoliți îl opresc iar ....;Simple;Real;Negative;Manie;No
426448238_10230885883191845_8498433358553736147_n.jpg;facebook.com;https://www.facebook.com/photo/?fbid=10230885883271847&set=gm.7413070842088440&idorvanity=2077133242348920;Când vă despartiti si vă cereti cadourile inapoi.;Combination;Real;Neutral;Surpriza;No
397909500_853314419830110_199618704365673501_n.jpg;facebook.com;https://www.facebook.com/photo/?fbid=853314389830113&set=gm.7014422255286636&idorvanity=2077133242348920;Plantele din casă când văd că pun apă în espressorul de cafea;Simple;Real;Neutral;Tristete;No
Screenshot 2024-06-07 at 21.07.34.png;instagram.com;https://www.instagram.com/p/C6x1Nskti99/?hl=en;Atunci când te intorci de la muncă din Italia si trebuie sã te culci din nou cu souțl tău pe gratis...;Simple;Real;Negative;Tristete;No
Screenshot 2024-06-07 at 21.12.21.png;instagram.com;https://www.instagram.com/p/C6qHnmdAOMU/?hl=en;NU IMI PASA DE TRECUTUL TAU TRECUTUL EI:;Combination;Real;Neutral;Surpriza;No
Screenshot 2024-06-07 at 21.15.26.png;instagram.com;https://www.instagram.com/p/C6k936eN_Mw/?hl=en;I-am spus ca poate să o bage oriunde și el a băgat-o în sor'mea;Simple;Real;Negative;Tristete;No
Screenshot 2024-06-07 at 21.17.38.png;instagram.com;https://www.instagram.com/p/C5sVNjNtCYK/?hl=en;Când cineva îmi zice "iar mănânci?";Simple;Real;Neutral;Manie;No
Screenshot 2024-06-07 at 21.19.53.png;instagram.com;https://www.instagram.com/p/C5pvttrAXLU/?hl=en;Când i-ai trimis mesajul acum 7h si a fost activa acum 10 minute;Simple;Fake;Negative;Tristete;No
Screenshot 2024-06-07 at 21.44.45.png;instagram.com;https://www.instagram.com/p/C5aS-qvN3lV/?hl=en;"câtă răbdare poti avea?" eu:;Simple;Real;Neutral;Surpriza;No
Screenshot 2024-06-07 at 21.45.47.png;instagram.com;https://www.instagram.com/p/C5IdHnZAvOg/?hl=en;Eu asteptând sã îmi dai mesaj;Simple;Real;Negative;Tristete;No
Screenshot 2024-06-07 at 21.47.12.png;instagram.com;https://www.instagram.com/p/C4-FP_tgFO3/?hl=en;Întâi facem o poza sa punem pe story  Eu:;Simple;Real;Neutral;Surpriza;No
Screenshot 2024-06-07 at 21.48.29.png;instagram.com;https://www.instagram.com/p/C42W8edNMsg/?hl=en;Eu făcându mi câtiva cartofi si două ouă ochiuri;Simple;Real;Neutral;Frica;No
Screenshot 2024-06-07 at 21.50.21.png;instagram.com;https://www.instagram.com/p/C4zw9wlgbID/?hl=en;CIORBĂ DE BERISOARE, urmăriți-ne pentru mai multe rețete!!;Simple;Real;Neutral;Surpriza;No
Screenshot 2024-06-07 at 21.52.27.png;instagram.com;https://www.instagram.com/p/C4FbcYLtRye/?hl=en;Eu uitându-mã la povestea mea la fiecare 2 minute pentru că imi place melodia pe care am pus-o;Simple;Real;Positive;Bucurie;No
Screenshot 2024-06-07 at 21.53.46.png;instagram.com;https://www.instagram.com/p/C39s0LWtdlh/?hl=en;Asa arata Raiul pentru o fata;Simple;Real;Positive;Dragoste;No
Screenshot 2024-06-07 at 21.57.39.png;instagram.com;https://www.instagram.com/p/C3uQ9rVN84h/?hl=en;chelnerul: plătiți împreună sau separat?  femeile:;Simple;Real;Neutral;Frica;No
Screenshot 2024-06-07 at 21.59.50.png;instagram.com;https://www.instagram.com/p/C3mh0tft1Ak/?hl=en;Cand cuiva Începe sã îi pese de mine Eu:aici suna a manevră;Simple;Fake;Negative;Frica;No
Screenshot 2024-06-07 at 22.01.59.png;instagram.com;https://www.instagram.com/p/C3XFw4aNi8Q/?hl=en;Eu la 13 ani: Cum am făcut 18 ani dau de carnet și îmi iau mașină Eu la 18 ani:;Combination;Fake;Neutral;Tristete;No
Screenshot 2024-06-07 at 22.06.43.png;instagram.com;https://www.instagram.com/p/C6gRMMGN_rt/?hl=en;"VREAU SI EU O EMOLOAICA DIN AIA";Simple;Fake;Neutral;Dragoste;No
Screenshot 2024-06-07 at 22.11.09.png;instagram.com;https://www.instagram.com/p/CnpZtuntDKj/?hl=en;degeaba ma vorbiți de bine ca mie tot rau imi merge;Simple;Real;Negative;Tristete;No
Screenshot 2024-06-07 at 22.12.50.png;instagram.com;https://www.instagram.com/p/Cngu-NetGjW/?hl=en;Anestezie lași 2022;Simple;Real;Negative;Frica;No
Screenshot 2024-06-07 at 22.23.07.png;instagram.com;https://www.instagram.com/p/CcVrID4ties/?hl=en;CE S-A SCHIMBAT TURNU EFEL;Simple;Real;Positive;Surpriza;No
Screenshot 2024-06-07 at 22.24.03.png;instagram.com;https://www.instagram.com/p/CcSRV1ktVsN/?hl=en;Saptamana cailor la lidl;Simple;Fake;Neutral;Surpriza;No
Screenshot 2024-06-07 at 22.27.07.png;instagram.com;https://www.instagram.com/p/CTJm8kkqCUk/?hl=en;Checutu';Simple;Fake;Neutral;Surpriza;No
Screenshot 2024-06-07 at 22.28.24.png;instagram.com;https://www.instagram.com/p/CTB2cRSquBk/?hl=en;CAND INTRA HOȚII IN CASA SI TE UITI CUM CAUTA BANII PE CARE NU II AI;Simple;Real;Negative;Tristete;No
Screenshot 2024-06-07 at 22.31.40.png;instagram.com;https://www.instagram.com/p/C0hZ9RDtEdK/?hl=en;Eu Tu;Combination;Fake;Positive;Dragoste;No
Screenshot 2024-06-07 at 22.45.13.png;instagram.com;https://www.instagram.com/p/CcTKYuottfU/?hl=en;M-AM DUS PE ȘANTIER, POATE AȘA CONSTRUIM ȘI NOI UN VIITOR ÎMPREUNA;Simple;Real;Neutral;Dragoste;No
Screenshot 2024-06-07 at 22.47.01.png;instagram.com;https://www.instagram.com/p/CZueNyTAtp0/?hl=en;cu berea in mana si cu gandul la tine;Simple;Real;Positive;Dragoste;No